The oil has spilled out.	Ang langis ay tumagas.
The oil has spilled over.	Ang langis ay umapaw.
The okra is exceptional.	Katangi-tangi ang okra.
The old clock is still in use.	Ginagamit pa ang lumang orasan.
The oleander is artificial.	Artipisyal ang adelpa.
The oleander is exceptional.	Katangi-tangi ang adelpa.
The oleander is fragrant.	Mahalimuyak ang adelpa.
The oleander is nutritious.	Masustansya ang adelpa.
The oleander is tasteless.	Matabang ang adelpa.
The one practicing is panting.	Hinihingal ang nag-eensayo.
The onion is artificial.	Artipisyal ang sibuyas.
The onion is exceptional.	Katangi-tangi ang sibuyas.
The onion is fragrant.	Mahalimuyak ang sibuyas.
The onion is nutritious.	Masustansya ang sibuyas.
The opposing team lost.	Natalo ang kalabang koponan.
The opposing team won.	Nanalo ang kalabang koponan.
The orchid is artificial.	Artipisyal ang orkidyas.
The orchid is exceptional.	Katangi-tangi ang orkidyas.
The orchid is fragrant.	Mahalimuyak ang orkidyas.
The orchid is nutritious.	Masustansya ang orkidyas.
The orchid is tasteless.	Matabang ang orkidyas.
The oregano is artificial.	Artipisyal ang oregano.
The oregano is exceptional.	Katangi-tangi ang oregano.
The oregano is fragrant.	Mahalimuyak ang oregano.
The oregano is nutritious.	Masustansya ang oregano.
The oregano is tasteless.	Matabang ang oregano.
The other bears scream.	Ang ibang oso ay sumigaw.
The other bull is excited.	Ang ibang toro ay natutuwa.
The other day she asked.	noong isang araw ay nagtanong siya.
The other duck is excited.	Ang ibang bibe ay natutuwa.
The other fishes are scared.	Takot ang ibang isda.
The other frogs are scared.	Takot ang ibang palaka.
The other goats scream.	Ang ibang kambing ay sumigaw.
The other snake is excited.	Ang ibang ahas ay natutuwa.
The outing was bad.	Ang pagliliwaliw ay masama.
The owl couldn't stop.	Hindi ang kuwago makatigil.
The owl didn't vote for tom.	Hindi ng kuwago binoto si tom.
The owl do not have time.	Wala ang kuwago oras.
The owl fell asleep in class.	Napatulog ang kuwago sa klase.
The owl has huge eyes.	May malaking mata ang kuwago.
The owl have class tomorrow.	May klase ang kuwago bukas.
The owl hit on an idea.	Meron ang kuwago naisip.
The owl know that she is cute.	Alam ng kuwago kyut siya.
The owl know tom lied.	Alam ng kuwago nagsinungaling si tom.
The owl like the dog.	Gusto ng kuwago yung aso.
The owl like this dog.	Gusto ng kuwago itong asong ito.
The owl like turtles.	Gusto ng kuwago ang mga pagong.
The owl listen to music.	Nakikinig ang kuwago sa musika.
The owl lost an earring.	Nawalan ang kuwago ng hikaw.
The owl must go right away.	Dapat basta umalis na ang kuwago.
The owl stole it from tom.	Ninakaw ng kuwago ito kay tom.
The owl want you to sing.	Gusto ng kuwago kumanta ka.
The owl was very hungry.	Ginutom ang kuwago ng maigi.
The owl went on reading.	Tinuloy ng kuwago ang pagbabasa.
The owl will get some ice.	Kukuha ang kuwago ng yelo.
The owl won't stand for this.	Hindi maaari ito.
The owls do not like tom.	Hindi ng mga kuwago gusto si tom.
The owls lost again.	Natalo nanaman ang mga kuwago.
The pain in my foot is gone.	Nawala na ang sakit sa paa ko.
The palace is full of cows.	Puno ang palasyo ng baka.
The papaya is artificial.	Artipisyal ang papaya.
The papaya is exceptional.	Katangi-tangi ang papaya.
The papaya is fragrant.	Mahalimuyak ang papaya.
The papaya is nutritious.	Masustansya ang papaya.
The paper given was not enough.	Kulang ang papel na ibinigay.
The paper goes up slowly.	Mabagal umangat ang papel.
The papers go up slowly.	Mabagal umangat ang mga papel.
The party has just begun.	Kasisimula pa lang ng kasiyahan.
The party is just beginning.	Nagsisimula pa lang ang party.
The peace would not last long.	Hindi nagtagal ang kapayapaan.
The pear is exceptional.	Katangi-tangi ang peras.
The pearl is in the east.	Nasa silangan ang perlas.
The pencil lead is color gray.	Kulay abo ang lead ng lapis.
The pencil lead is gray.	Kulay abo ang lead ng lapis.
The people are friendly to us.	Mababait ang mga tao sa amin.
The pepper is artificial.	Artipisyal ang paminta.
The pepper is exceptional.	Katangi-tangi ang paminta.
The pepper is fragrant.	Mahalimuyak ang paminta.
The pepper is nutritious.	Masustansya ang paminta.
The phone is ringing.	Ang telepono ay tumutunog.
The pig eats worms.	Kumakain ng mga uod ang baboy.
The pig has always been lucky.	Maswerte ang baboy.
The pig has huge shoulders.	May malaking balikat ang baboy.
The pig hears noises.	Nakarinig ng ingay ang baboy.
The pig is given a nickname.	Binigyan ng alyas ang baboy.
The pig is going to school.	Papasok ang baboy sa paaralan.
The pig is not special.	Hindi espesyal ang baboy.
The pig is rolling in the mud.	Gumugulong sa putik ang baboy.
The pig presents evidence.	Naghain ng ebidensya ang baboy.
The pig sees a light.	Nakakita ang baboy ng ilaw.
The pig walks around.	Naglakad lakad ang baboy sa paligid.
The pig's blood is edible.	Nakakain ang dugo ng baboy.
The pig's blood is red.	Pula ang dugo ng baboy.
The pigs practiced well.	Nagensayo nang maigi ang mga baboy.
The pillow feels nice to hug.	Ang unan ay masarap yakapin.
The pineapple is artificial.	Artipisyal ang pinya.
The pineapple is exceptional.	Katangi-tangi ang pinya.
The pineapple is fragrant.	Mahalimuyak ang pinya.
The pineapple is nutritious.	Masustansya ang pinya.
The pineapple is tasteless.	Matabang ang pinya.
The pirate cockroach is closing.	Dumidikit ang piratang ipis.
The pirate hen is closing.	Dumidikit ang piratang inahin.
The pirate rabbit is closing.	Dumidikit ang piratang kuneho.
The pizza smells delicious.	Amoy masarap ang pizza.
The place is full of kittens.	Puno ang lugar ng mga kuting.
The place is full of lions.	Puno ang lugar ng mga leon.
The place is full of pigs.	Puno ang lugar ng mga baboy.
The place is peace and quiet.	Mapayapa at matahimik sa lugar.
The place is too crowded.	Ang lugar ay sobrang siksikan.
The plan proved a disaster.	Ang plano ay hindi gumana.
The plan proved tiring.	Ang plano ay nakakapagod.
The plane took off last night.	Lumipad yung eroplano kagabi.
The plant is wearing pants.	Nakasuot ng pantalon ang halaman.
The plants are growing.	Tumutubo ang mga halaman.
The plants are more colorful.	Mas makulay ang mga halaman.
The poem is being written by him.	Ang tula ay sinusulat niya.
The poem is written by him.	Ang tula ay sinulat niya.
The poem will be written by him.	Ang tula ay susulatin niya.
The police are after me.	Hinahabol ako ng mga pulis.
The pomelo is exceptional.	Katangi-tangi ang suha.
The pomelo is nutritious.	Masustansya ang suha.
The potatoes are harvested.	Inani ang mga patatas.
The pots are more colorful.	Mas makulay ang mga paso.
The president is lying.	Nagsisinungaling ang presidente.
The prince cow is poisoned.	Nalason ang prinsipeng baka.
The prince cow is rich.	Mayaman ang prinsipeng baka.
The prince cow wins.	Nanalo ang prinsipeng baka.
The prince cow works hard.	Nagtatrabaho ang prinsipeng baka.
The principal is busy.	Ang punongguro ay abala.
The professor is teaching.	Nagtuturo ang propesor.
The professor extended time.	Sumobra sa oras ang propesor.
The professor will teach.	Magtuturo ang propesor.
The pumpkin became a carriage.	Naging karwahe ang kalabasa.
The pumpkin is artificial.	Artipisyal ang kalabasa.
The pumpkin is beautiful.	Maganda ang kalabasa.
The pumpkin is colored orange.	Kulay kahel ang kalabasa.
The pumpkin is delicious.	Masarap ang kalabasa.
The pumpkin is exceptional.	Katangi-tangi ang kalabasa.
The pumpkin is fragrant.	Mahalimuyak ang kalabasa.
The pumpkin is inadequate.	Kulang ang kalabasa.
The pumpkin is nutritious.	Masustansya ang kalabasa.
The pumpkin is tasteless.	Matabang ang kalabasa.
The pumpkin is valuable.	Mahalaga ang kalabasa.
The pupil is studying.	Ang mag-aaral ay nag-aaral.
The pupil will study.	Ang mag-aaral ay mag-aaral.
The puppies buy equipment.	Bumili ng gamit ang mga tuta.
The puppies chooses team.	Namili ng koponan ang mga tuta.
The puppies love floorball.	Mahal ng mga tuta ang floorball.
The puppies train at night.	Nagsasanay ang mga tuta sa gabi.
The puppies train at the gym.	Nagsasanay ang mga tuta sa gym.
The puppies train together.	Nagsanay ng sabay ang mga tuta.
The puppies weren't lying.	Ang mga tuta ay di nagsinungaling.
The puppy has a helmet.	Ang tuta ay may helmet.
The puppy has a new ball.	May bagong bola ang tuta.
The puppy has a rival.	Ang tuta ay may kalaban.
The puppy has eight helmets.	Ang tuta ay may walong helmet.
The puppy has five helmets.	Ang tuta ay may limang helmet.
The puppy has four helmets.	Ang tuta ay may apat na helmet.
The puppy has nine helmets.	Ang tuta ay may siyam na helmet.
The puppy has one helmet.	Ang tuta ay may isang helmet.
The puppy has seven helmets.	Ang tuta ay may pitong helmet.
The puppy has six helmets.	Ang tuta ay may anim na helmet.
The puppy has ten helmets.	Ang tuta ay may sampung helmet.
The puppy has three helmets.	Ang tuta ay may tatlong helmet.
The puppy has two helmets.	Ang tuta ay may dalawang helmet.
The puppy is a goalkeeper.	Goalkeeper ang tuta.
The puppy is not playing.	Hindi naglalaro ang tuta.
The puppy passes the ball.	Pinasa ng tuta ang bola.
The puppy shoots the ball.	Tinira ng tuta ang bola.
The puppy smoked one.	Ang tuta ay umusok ng isa.
The puppy steals the ball.	Inagaw ng tuta ang bola.
The puppy train at the road.	Nagsasanay ang tuta sa kalsada.
The puppy will miss the game.	Hindi makakalaro ang tuta.
The puppy will start the game.	Magsisimula sa laro ang tuta.
The puppy's ball is black.	Ang bola ng tuta ay itim.
The puppy's ball is blue.	Ang bola ng tuta ay asul.
The puppy's ball is heavy.	Ang bola ng tuta ay magbigat.
The puppy's ball is light.	Ang bola ng tuta ay magaan.
The puppy's ball is red.	Ang bola ng tuta ay pula.
The puppy's ball is white.	Ang bola ng tuta ay puti.
The puppy's helmet is light.	Ang helmet ng tuta ay magaan.
The puppy's team is leading.	Lamang ang koponan ng tuta.
The puppy's team is strong.	Malakas ang koponan ng tuta.
The puppy's team is trailing.	Naghahabol ang koponan ng tuta.
The puppy's team is training.	Nagsasanay ang koponan ng tuta.
The puppy's team lost.	Natalo ang koponan ng tuta.
The puppy's team score.	Nakatira ang koponan ng tuta.
The puppy's team won.	Nanalo ang koponan ng tuta.
The purple yam is artificial.	Artipisyal ang ube.
The purple yam is exceptional.	Katangi-tangi ang ube.
The purple yam is fragrant.	Mahalimuyak ang ube.
The purple yam is nutritious.	Masustansya ang ube.
The rabbit ate dinner.	Kumain ng hapunan ang kuneho.
The rabbit enters a room.	Pumasok ang kuneho sa kwarto.
The rabbit escapes the island.	Tumakas ang kuneho sa isla.
The rabbit find a letter.	May nahanap ng sulat ang kuneho.
The rabbit finds a pet.	Nahanap ng kuneho ang alaga.
The rabbit gets into the boat.	Sumakay ng barko ang kuneho.
The rabbit has a ship.	Ang kuneho ay may barko.
The rabbit has two friends.	May dalawang kaibigan ang kuneho.
The rabbit is having a race.	Nakikipagkarera ang kuneho.
The rabbit is holding the fruit.	Hawak ng kuneho ang prutas.
The rabbit joins the pirate.	Sumama ang kuneho sa pirata.
The rabbit reads the letter.	Binasa ng kuneho ang liham.
The rabbit search the building.	Nilibot ng kuneho ang gusali.
The rabbit stays in the island.	Nanatili ang kuneho sa isla.
The rabbit steals the fruit.	Ninakaw ng kuneho ang prutas.
The rabbit steps on sand.	Tumapak sa buhangin ang kuneho.
The rabbit took out a watch.	May nilabas na relo ang kuneho.
The rabbit's boat is damaged.	Nasira ang barko ng kuneho.
The rabbit's brother is alive.	Buhay ang kapatid ng kuneho.
The rabbit's brother is dead.	Patay ang kapatid ng kuneho.
The rabbit's brother is happy.	Masaya ang kapatid ng kuneho.
The rabbit's brother is near.	Malapit ang kapatid ng kuneho.
The rabbit's brother is sad.	Malungkot ang kapatid ng kuneho.
The rabbits are reunited.	Nagkitang muli ang mga kuneho.
The race is far from over.	Malayo pa ang karera sa katapusan.
The race is full of carabaos.	Puno ang karera ng mga kalabaw.
The race is full of sharks.	Puno ang karera ng mga pating.
The radish is artificial.	Artipisyal ang labanos.
The radish is exceptional.	Katangi-tangi ang labanos.
The radish is fragrant.	Mahalimuyak ang labanos.
The radish is nutritious.	Masustansya ang labanos.
The rain has already stopped.	Tumila na ang ulan.
The rain lasted a week.	Umulan nang isang linggo.
The rain spoiled our picnic.	Sinira ng ulan ang piknik namin.
The rainbow is colorful.	Makulay ang bahaghari.
The rainbow is not fake.	Hindi peke ang bahaghari.
The rat is listening to vixx.	Nakikinig ang daga sa vixx.
The rat still have a slight limp.	May pilay na unti ang daga.
The rat told them no.	Sinabi ng daga sa kanila hindi.
The rats adore her.	Kinagugustuhan siya ng mga daga.
The rats all burst out laughing.	Tumatawa ang mga daga.
The rats believe in god.	Naniniwala ng mga daga sa diyos.
The rats bottled the beer.	Binote ng mga daga ang alak.
The rats can leave.	Pwede nang umalis ang mga daga.
The rats didn't find her.	Hindi siya mahanap ng mga daga.
The rats like you very much.	Gusto ka ng mga daga ng sobra.
The rats voted against it.	Bumoto ang mga daga laban dito.
The rats were not lying.	Hindi nagsisinungaling ang mga daga.
The rats were very amused.	Naaliw ang mga daga.
The referee stops the match.	Tinigil ng opisyal ang laro.
The relationship is like a game.	Ang relasyon ay parang laro.
The rent is due tomorrow.	bayaran na ng renta bukas.
The researcher researched.	Ang mananaliksik ay nanaliksik.
The researcher researches.	Ang mananaliksik ay nagsasaliksik.
The restaurant seems expensive.	Mukhang mahal yung kainan.
The restroom was gross.	Ang banyo ay nakakadiri.
The result was good.	Ang kinalabasan ay maganda.
The rice is exceptional.	Katangi-tangi ang kanin.
The rice is not yet cooked.	Hindi pa naluluto ang kanin.
The rival bee is a keeper.	Tagabantay ang kalabang bubuyog.
The rival bee is a shooter.	Tagatira ang kalabang bubuyog.
The rival carabao lost.	Natalo ang kalabang kalabaw.
The rival carabao won.	Nanalo ang kalabang kalabaw.
The rival puppy is a keeper.	Tagabantay ang kalabang tuta.
The rival puppy is a shooter.	Tagatira ang kalabang tuta.
The rival shark lost.	Natalo ang kalabang pating.
The rival shark won.	Nanalo ang kalabang pating.
The rival tiger is a keeper.	Tagabantay ang kalabang tigre.
The rival tiger is a shooter.	Tagatira ang kalabang tigre.
The rivals fought hard.	Naglaban ang magkaribal.
The road are too dark.	Sobrang dilim sa kalsada.
The road was blocked.	Ang kalsada ay naharangan.
The roads are slippery.	Ang mga kalsada ay madulas.
The roasted pig is delicious!	Ang sarap ng lechon!
The rock is a writer.	Isang manunulat ang bato.
The rock is writing a letter.	Nagsusulat ng liham ang bato.
The rock was thrown by the bear.	Binato ang bato ng oso.
The rock wrote me a letter.	Sinulatan ako ng liham ng bato.
The room is full of stuff.	Ang kwarto ay puno ng gamit.
The room smells clean.	Amoy malinis ang kwarto.
The rooms are for the lions.	Ang kwarto ay para sa mga leon.
The rooms are for the pigs.	Ang kwarto ay para sa mga baboy.
The rooster must see her.	Kailangan siyang makita ng tandang.
The roosters already did that.	Nagawa na iyan ng mga tandang.
The roosters were cheerful.	Masayahin ang mga tandang.
The roosters will find them.	Mahahanap sila ng mga tandang.
The rose is blooming.	Ang rosas ay namumukadkad.
The rose is exceptional.	Katangi-tangi ang rosas.
The ruble has cratered.	Ang ruble ay may bunganga.
The rumor turned out to be true.	Tunay pala yung tsismis.
The runner runs fast.	Mabilis tumakbo ang mananakbo.
The school has many buildings.	Maraming gusali sa paaralan.
The school is far to walk.	Malayo lakarin ang paaralan.
The school is full of deer.	Puno ang paaralan ng usa.
The scorpion folded one.	Nagtupi ang alakdan ng isa.
The scorpion keep sabbath.	Nagsisimba ang alakdan.
The scorpion runs fast.	Tumakbo ang alakdan ng mabilis.
The scorpion should be studying.	Dapat nag-aaral ang alakdan.
The scorpion sneaks up behind.	Lumikod ang alakdan.
The scorpion wouldn't have thought.	Hindi inakala ng alakdan.
The scorpion's friend is bad.	Masama ang kaibigan ng alakdan.
The scorpion's team attacks.	Umatake ang koponan ng alakdan.
The scorpion's team loses.	Natalo ang koponan ng alakdan.
The scorpion's team win.	Nanalo ang koponan ng alakdan.
The scorpions return home.	Umuwi ang mga alakdan.
The script is hilarious.	Ang script ay nakakatawa.
The sea was so beautiful.	Sobrang ganda ng dagat.
The seagull attends training.	Nagsanay ang tagak.
The seagull can multiply.	Kayang magparami ng tagak.
The seagull controls waves.	Nakokontrol ng tagak ang alon.
The seagull fails the exam.	Bumagsak ang tagak sa pagsusulit.
The seagull had an exam.	Nagkaroon ng pagsusulit ang tagak.
The seagull has a family.	May pamilya ang tagak.
The seagull has many friends.	Maraming kaibigan ang tagak.
The seagull hides well.	Nagtago ang tagak ng mabuti.
The seagull hits an apple.	Tumama ang tagak sa mansanas.
The seagull is not hurt.	Hindi nasaktan ang tagak.
The seagull is watching Naruto.	Nanonood ang tagak ng naruto.
The seagull jumps high.	Tumalon ang tagak ng mataas.
The seagull loves girls.	Mahal ng tagak ang mga babae.
The seagull passes the exam.	Pumasa ang tagak sa pagsusulit.
The seagulls all sat.	Umupo ang lahat ng mga tagak.
The seagulls are all dead.	Patay ang mga tagak.
The seagulls are unemployed.	Walang trabaho ang mga tagak.
The seagulls didn't pay me.	Hindi ako binayaran ng mga tagak.
The seagulls had nothing.	Walang pagmamay-ari ang mga tagak.
The seagulls kissed again.	Naghalikan ang mga tagak ulit.
The seagulls look rather fake.	Mukhang peke ang mga tagak.
The seagulls missed him.	Hindi nakita ng mga tagak siya.
The seagulls see dan.	Nakita ng mga tagak si dan.
The seagulls warned you.	Binalaan ng mga tagak siya.
The seagulls were all busy.	Abala ang lahat ng mga tagak.
The second chair is broken!	Sira ang ikalawang silya!
The second chair is broken!	Sira ang ikalawang upuan!
The second chair is broken.	Sira ang ikalawang silya.
The second chair is broken.	Sira ang ikalawang upuan.
The second chair is vacant.	Bakante ang ika-dalawang silya.
The second chair is vacant.	Bakante ang pangalawang upuan.
The second computer is broken!	Sira ang ikalawang kompyuter!
The second computer is broken.	Sira ang ikalawang kompyuter.
The second seat is vacant.	Bakante ang ika-dalawang upuan.
The second seat is vacant.	Bakante ang pangalawang upuan.
The second table is broken!	Sira ang ikalawang mesa!
The second table is broken.	Sira ang ikalawang mesa.
The section Willow is naughty.	Makulit ang pangkat Willow.
The security guard is sleeping.	Ang gwardya ay natutulog.
The semester is almost done.	Malapit na matapos ang semestre.
The sesame is artificial.	Artipisyal ang linga.
The sesame is exceptional.	Katangi-tangi ang linga.
The sesame is nutritious.	Masustansya ang linga.
The seventh chair is vacant.	Bakante ang ika-pitong upuan.
The seventh chair is vacant.	Bakante ang pang-pitong upuan.
The seventh seat is vacant.	Bakante ang ika-pitong upuan.
The seventh seat is vacant.	Bakante ang pang-pitong upuan.
The shark had no injuries.	Walang sugat ang pating.
The shark has a lot of friends.	Maraming kaibigan ang pating.
The shark is excited to win.	Natutuwa ang pating na manalo.
The shark is sad to lose.	Malungkot ang pating na matalo.
The shark makes a mistake.	Nagkamali ang pating.
The shark's bike broke.	Nasira ang bisikleta ng pating.
The shark's bike was fast.	Mabilis ang bisikleta ng pating.
The sharks cross the line.	Tumawid sa linya ang mga pating.
The sharks knows the routes.	Alam ng mga pating ang ruta.
The sharks left the city.	Umalis ng siyudad ang mga pating.
The sheep are on the run.	Ang mga tupa ay tumatakbo.
The sheep closes the notebook.	Sinarado ng tupa ang talaan.
The sheep come up with a plan.	Bumuo ng plano ang mga tupa.
The sheep finds a notebook.	Nakakita ang tupa ng talaan.
The sheep has friends.	May kaibigan ang kakaibang tupa.
The sheep is in a car.	Nasa isang sasakyan ang tupa.
The sheep opens the notebook.	Binuksan ng tupa ang talaan.
The ship is bound for Finland.	Papuntang Finland ang barko.
The ship left ahead of time.	Maagang umalis ang barko.
The show is starting.	Ang palabras ay nagsisimula na.
The shrimp acquires a sword.	Nakakuha ng espada ang hipon.
The shrimp defeats a monster.	Natalo ng hipon ang halimaw.
The shrimp forms a group.	Bumuo ng grupo ang mga hipon.
The shrimp is not hairy.	Hindi mabuhok ang hipon.
The shrimp is not the savior.	Hindi tagapagligtas ang hipon.
The shrimp is on its way upwards.	Patungo sa itaas ang hipon.
The shrimp signed up for the game.	Sumali ang hipon sa laro.
The shrimp trains everyday.	Nag-ensayo ang hipon araw-araw.
The shrimps cannot do it.	Hindi kaya ng mga hipon.
The shrimps require wings.	Kailangan ng mga hipon ng pakpak.
The signal strength is weak.	Ang signal ay sobrang mahina.
The sixth chair is vacant.	Bakante ang ika-anim na upuan.
The sixth chair is vacant.	Bakante ang pang-anim na upuan.
The sixth seat is vacant.	Bakante ang ika-anim na upuan.
The sixth seat is vacant.	Bakante ang pang-anim na upuan.
The skies will be clear.	Magiging maaliwalas ang langit.
The sky at dusk is red.	Ang langit ay pula sa takipsilim.
The sky is colored blue.	Kulay asul ang langit.
The sky is filled with stars.	Puno ng mga bituwin ang langit.
The sky is full of ash.	Puno ng abo ang langit.
The slipper is the right fit.	Ang tsinelas ay tama ang lapat.
the smoke and everything else.	ang usok at lahat ng iba pa.
The snail can't sleep.	Hindi ang suso makatulog.
The snail did see him.	Nakita ng suso nga siya.
The snail didn't scream.	Hindi ang suso sumigaw.
The snail didn't see her.	Di ng suso siya nakita.
The snail drinks water.	Umiinom ng tubig ang suso.
The snail haven't tried.	Hindi ng suso pa nasubukan.
The snail hit on an idea.	Meron ang suso naisip.
The snail know that you are a teacher.	Alam ng suso guro ka.
The snail like your mirror.	Gusto ng suso ang salamin mo.
The snail listen to music.	Nakikinig ang suso sa musika.
The snail may die tomorrow.	Maaari ang suso mamatay bukas.
The snail miss her so much.	Namimiss ng suso na siya.
The snail saw tom a while back.	Nakita ng suso si tom kanina.
The snail think he'll come.	Tingin ng suso darating siya.
The snail walked alone.	Naglakad ang suso mag-isa.
The snail was out all day.	Buong araw ang suso wala sa bahay.
The snail was very hungry.	Ginutom ang suso ng maigi.
The snail won't lose anything.	Walang mawawala sa akin.
The snails ignored me.	Hindi nila ang suso pinansin.
The snails put the blame on me.	Ang suso ang sinisi nila.
The snails stopped the music.	Pinigil nila ang musika.
The snake goes round and round.	Umikot ng umikot ang ahas.
The snake had other plans.	Mayroong ibang plano ang ahas.
The snake has a pet snake.	Mayroong alagang ahas ang ahas.
The snake has lots of friends.	Maraming kaibigan ang ahas.
The snake has no family.	Walang pamilya ang ahas.
The snake is a carpenter.	Ang ahas ay isang karpintero.
The snake is a lawyer.	Ang ahas ay isang abugado.
The snake is a rebel.	Ang ahas ay isang rebelde.
The snake is not friendly.	Hindi palakaibigan ang ahas.
The snake knows how to skate.	Marunong mag-iskating ang ahas.
The snake learns from the master.	Natuto ang ahas sa master.
The snake made no mistakes.	Hindi nagkamali ang ahas.
The snake performs a routine.	Nagtanghal ang ahas.
The snake's coach is happy.	Natuwa ang tagapagturo ng ahas.
The snake's jaw is elastic.	Nababanat ang panga ng ahas.
The snakes are on a plane.	Nasa eroplano ang mga ahas.
The snow, she replies.	Ang niyebe, sagot niya.
The soap is gentle to the hands.	Banayad sa kamay ang sabon.
The soccer game is tomorrow.	ang soccer game ay bukas na.
The soldiers are coming.	Ang mga sundalo ay paparating.
The song today is nice.	ang ganda ng kanta ngayong umaga.
The soup is on the table.	Ang sopas ay nasa lamesa.
The soup smells great.	Mabango ang amoy ng sopas.
The soup tasted salty.	Ang sopas ay naglasang maalat.
The soup was cooked well.	Ang sopas ay naluto ng mabuti.
The soursop is artificial.	Artipisyal ang guyabano.
The soursop is beautiful.	Maganda ang guyabano.
The soursop is delicious.	Masarap ang guyabano.
The soursop is exceptional.	Katangi-tangi ang guyabano.
The soursop is fragrant.	Mahalimuyak ang guyabano.
The soursop is inadequate.	Kulang ang guyabano.
The soursop is nutritious.	Masustansya ang guyabano.
The soursop is tasteless.	Matabang ang guyabano.
The soursop is valuable.	Mahalaga ang guyabano.
The spider beats the enemy.	Tinalo ng gagamba ang kalaban.
The spider buys stuff.	Bumili ang gagamba ng gamit.
The spider discovers something.	May nadiskubre ang gagamba.
The spider enters the village.	Pumasok ang gagamba sa bayan.
The spider fights hard.	Lumaban ng malakas ang gagamba.
The spider has a round body.	Bilog ang katawa ng gagamba.
The spider has long legs.	Mahaba ang paa ng gagamba.
The spider is in danger.	Nasa panganib ang gagamba.
The spider is near the river.	Malapit ang gagamba sa ilog.
The spider leaves the village.	Umalis ang gagamba sa bayan.
The spider lives in a village.	Tumitira ang gagamba sa bayan.
The spider makes a decision.	Nagdesisyon ang gagamba.
The spider makes friends.	Nakipagkaibigan ang gagamba.
The spider regain energy.	Nakakuha ng lakas ang gagamba.
The spider replenishes energy.	Nagpalakas ang gagamba.
The spider seeks help.	Humingi ng tulong ang gagamba.
The spider senses danger.	Nakaramdam ng panganib ang gagamba.
The spider's spirit helps.	Tumulong ang kaluluwa ng gagamba.
The spirit ant is effective.	Epektibo ang espiritung langgam.
The spirit ant is hungry.	Gutom ang espiritung langgam.
The spirit bee is effective.	Epektibo ang espiritung bubuyog.
The spirit bee is hungry.	Gutom ang espiritung bubuyog.
The spirit spider is hungry.	Gutom ang espiritung gagamba.
The squid believe in god.	Naniniwala ang pusit sa diyos.
The squid believe you.	Naniniwala ang pusit sayo.
The squid did see him.	Nakita ng pusit nga siya.
