how much do seven sesame cost?	magkano ang pitong linga?
how much do seven shark cost?	magkano ang pitong pating?
how much do seven shrimp cost?	magkano ang pitong hipon?
how much do seven soursoup cost?	magkano ang pitong guyabano?
how much do seven squash cost?	magkano ang pitong kalabasa?
how much do seven squid cost?	magkano ang pitong pusit?
how much do seven strawberry cost?	magkano ang pitong presa?
how much do seven sugar apple cost?	magkano ang pitong atis?
how much do seven tamarind cost?	magkano ang pitong sampalok?
how much do seven tomato cost?	magkano ang pitong kamatis ?
how much do seven turnip cost?	magkano ang pitong singkamas?
how much do seven wax gourd cost?	magkano ang pitong kundol?
how much do seven worm cost?	magkano ang pitong bulate?
how much do seventy fish cost?	magkano ang pitumpung isda?
how much do seventy ginger cost?	magkano ang pitumpung luya?
how much do seventy luffa cost?	magkano ang pitumpung patola?
how much do seventy mango cost?	magkano ang pitumpung mangga?
how much do seventy meat cost?	magkano ang pitumpung karne?
how much do seventy melon cost?	magkano ang pitumpung melon?
how much do seventy nuts cost?	magkano ang pitumpung mani?
how much do seventy pork cost?	magkano ang pitumpung baboy?
how much do seventy sesame cost?	magkano ang pitumpung linga?
how much do seventy shark cost?	magkano ang pitumpung pating?
how much do seventy shrimp cost?	magkano ang pitumpung hipon?
how much do seventy squid cost?	magkano ang pitumpung pusit?
how much do seventy worm cost?	magkano ang pitumpung bulate?
how much do six apple cost?	magkano ang anim na mansanas?
how much do six banana cost?	magkano ang anim na saging?
how much do six black plum cost?	magkano ang anim na duhat?
how much do six bottle gourd cost?	magkano ang anim na upo?
how much do six cabbage cost?	magkano ang anim na repolyo?
how much do six crab cost?	magkano ang anim na alimango?
how much do six durian cost?	magkano ang anim na duryan?
how much do six eggplant cost?	magkano ang anim na talong?
how much do six fish cost?	magkano ang anim na isda?
how much do six garlic cost?	magkano ang anim na bawang?
how much do six ginger cost?	magkano ang anim na luya?
how much do six guava cost?	magkano ang anim na bayabas?
how much do six jackfruit cost?	magkano ang anim na langka?
how much do six kidney bean cost?	magkano ang anim na patani?
how much do six lanzones cost?	magkano ang anim na lanzones?
how much do six legumes cost?	magkano ang anim na sitaw?
how much do six lima bean cost?	magkano ang anim na bataw?
how much do six luffa cost?	magkano ang anim na patola?
how much do six malay apple cost?	magkano ang anim na makopa?
how much do six mango cost?	magkano ang anim na mangga?
how much do six meat cost?	magkano ang anim na karne?
how much do six melon cost?	magkano ang anim na melon?
how much do six milkfish cost?	magkano ang anim na bangus?
how much do six mustard cost?	magkano ang anim na mustasa?
how much do six nuts cost?	magkano ang anim na mani?
how much do six octopus cost?	magkano ang anim na pugita?
how much do six onion cost?	magkano ang anim na sibuyas?
how much do six orange cost?	magkano ang anim na dalanghita?
how much do six papaya cost?	magkano ang anim na papaya?
how much do six pineapple cost?	magkano ang anim na pinya?
how much do six pork cost?	magkano ang anim na baboy?
how much do six radish cost?	magkano ang anim na labanos?
how much do six rambutan cost?	magkano ang anim na rambutan?
how much do six sardines cost?	magkano ang anim na sardinas?
how much do six sesame cost?	magkano ang anim na linga?
how much do six shark cost?	magkano ang anim na pating?
how much do six shrimp cost?	magkano ang anim na hipon?
how much do six soursoup cost?	magkano ang anim na guyabano?
how much do six squash cost?	magkano ang anim na kalabasa?
how much do six squid cost?	magkano ang anim na pusit?
how much do six strawberry cost?	magkano ang anim na presa?
how much do six sugar apple cost?	magkano ang anim na atis?
how much do six tamarind cost?	magkano ang anim na sampalok?
how much do six tomato cost?	magkano ang anim na kamatis ?
how much do six turnip cost?	magkano ang anim na singkamas?
how much do six wax gourd cost?	magkano ang anim na kundol?
how much do six worm cost?	magkano ang anim na bulate?
how much do sixty banana cost?	magkano ang animnapung saging?
how much do sixty crab cost?	magkano ang animnapung alimango?
how much do sixty durian cost?	magkano ang animnapung duryan?
how much do sixty fish cost?	magkano ang animnapung isda?
how much do sixty garlic cost?	magkano ang animnapung bawang?
how much do sixty ginger cost?	magkano ang animnapung luya?
how much do sixty guava cost?	magkano ang animnapung bayabas?
how much do sixty legumes cost?	magkano ang animnapung sitaw?
how much do sixty luffa cost?	magkano ang animnapung patola?
how much do sixty mango cost?	magkano ang animnapung mangga?
how much do sixty meat cost?	magkano ang animnapung karne?
how much do sixty melon cost?	magkano ang animnapung melon?
how much do sixty nuts cost?	magkano ang animnapung mani?
how much do sixty onion cost?	magkano ang animnapung sibuyas?
how much do sixty papaya cost?	magkano ang animnapung papaya?
how much do sixty pork cost?	magkano ang animnapung baboy?
how much do sixty sesame cost?	magkano ang animnapung linga?
how much do sixty shark cost?	magkano ang animnapung pating?
how much do sixty shrimp cost?	magkano ang animnapung hipon?
how much do sixty squid cost?	magkano ang animnapung pusit?
how much do sixty worm cost?	magkano ang animnapung bulate?
how much do ten apple cost?	magkano ang sampung mansanas?
how much do ten banana cost?	magkano ang sampung saging?
how much do ten black plum cost?	magkano ang sampung duhat?
how much do ten bottle gourd cost?	magkano ang sampung upo?
how much do ten cabbage cost?	magkano ang sampung repolyo?
how much do ten crab cost?	magkano ang sampung alimango?
how much do ten durian cost?	magkano ang sampung duryan?
how much do ten eggplant cost?	magkano ang sampung talong?
how much do ten fish cost?	magkano ang sampung isda?
how much do ten garlic cost?	magkano ang sampung bawang?
how much do ten ginger cost?	magkano ang sampung luya?
how much do ten guava cost?	magkano ang sampung bayabas?
how much do ten jackfruit cost?	magkano ang sampung langka?
how much do ten kidney bean cost?	magkano ang sampung patani?
how much do ten lanzones cost?	magkano ang sampung lanzones?
how much do ten legumes cost?	magkano ang sampung sitaw?
how much do ten lima bean cost?	magkano ang sampung bataw?
how much do ten luffa cost?	magkano ang sampung patola?
how much do ten malay apple cost?	magkano ang sampung makopa?
how much do ten mango cost?	magkano ang sampung mangga?
how much do ten meat cost?	magkano ang sampung karne?
how much do ten melon cost?	magkano ang sampung melon?
how much do ten milkfish cost?	magkano ang sampung bangus?
how much do ten mustard cost?	magkano ang sampung mustasa?
how much do ten nuts cost?	magkano ang sampung mani?
how much do ten octopus cost?	magkano ang sampung pugita?
how much do ten onion cost?	magkano ang sampung sibuyas?
how much do ten orange cost?	magkano ang sampung dalanghita?
how much do ten papaya cost?	magkano ang sampung papaya?
how much do ten pineapple cost?	magkano ang sampung pinya?
how much do ten pork cost?	magkano ang sampung baboy?
how much do ten radish cost?	magkano ang sampung labanos?
how much do ten rambutan cost?	magkano ang sampung rambutan?
how much do ten sardines cost?	magkano ang sampung sardinas?
how much do ten sesame cost?	magkano ang sampung linga?
how much do ten shark cost?	magkano ang sampung pating?
how much do ten shrimp cost?	magkano ang sampung hipon?
how much do ten soursoup cost?	magkano ang sampung guyabano?
how much do ten squash cost?	magkano ang sampung kalabasa?
how much do ten squid cost?	magkano ang sampung pusit?
how much do ten strawberry cost?	magkano ang sampung presa?
how much do ten sugar apple cost?	magkano ang sampung atis?
how much do ten tamarind cost?	magkano ang sampung sampalok?
how much do ten tomato cost?	magkano ang sampung kamatis ?
how much do ten turnip cost?	magkano ang sampung singkamas?
how much do ten wax gourd cost?	magkano ang sampung kundol?
how much do ten worm cost?	magkano ang sampung bulate?
how much do thirty fish cost?	magkano ang tatlumpung isda?
how much do thirty ginger cost?	magkano ang tatlumpung luya?
how much do thirty luffa cost?	magkano ang tatlumpung patola?
how much do thirty mango cost?	magkano ang tatlumpung mangga?
how much do thirty meat cost?	magkano ang tatlumpung karne?
how much do thirty melon cost?	magkano ang tatlumpung melon?
how much do thirty nuts cost?	magkano ang tatlumpung mani?
how much do thirty pork cost?	magkano ang tatlumpung baboy?
how much do thirty sesame cost?	magkano ang tatlumpung linga?
how much do thirty shark cost?	magkano ang tatlumpung pating?
how much do thirty shrimp cost?	magkano ang tatlumpung hipon?
how much do thirty squid cost?	magkano ang tatlumpung pusit?
how much do thirty worm cost?	magkano ang tatlumpung bulate?
how much do three apple cost?	magkano ang tatlong mansanas?
how much do three banana cost?	magkano ang tatlong saging?
how much do three black plum cost?	magkano ang tatlong duhat?
how much do three bottle gourd cost?	magkano ang tatlong upo?
how much do three cabbage cost?	magkano ang tatlong repolyo?
how much do three crab cost?	magkano ang tatlong alimango?
how much do three durian cost?	magkano ang tatlong duryan?
how much do three eggplant cost?	magkano ang tatlong talong?
how much do three fish cost?	magkano ang tatlong isda?
how much do three garlic cost?	magkano ang tatlong bawang?
how much do three ginger cost?	magkano ang tatlong luya?
how much do three guava cost?	magkano ang tatlong bayabas?
how much do three jackfruit cost?	magkano ang tatlong langka?
how much do three legumes cost?	magkano ang tatlong sitaw?
how much do three lima bean cost?	magkano ang tatlong bataw?
how much do three luffa cost?	magkano ang tatlong patola?
how much do three mango cost?	magkano ang tatlong mangga?
how much do three meat cost?	magkano ang tatlong karne?
how much do three melon cost?	magkano ang tatlong melon?
how much do three milkfish cost?	magkano ang tatlong bangus?
how much do three mustard cost?	magkano ang tatlong mustasa?
how much do three nuts cost?	magkano ang tatlong mani?
how much do three octopus cost?	magkano ang tatlong pugita?
how much do three onion cost?	magkano ang tatlong sibuyas?
how much do three papaya cost?	magkano ang tatlong papaya?
how much do three pineapple cost?	magkano ang tatlong pinya?
how much do three pork cost?	magkano ang tatlong baboy?
how much do three radish cost?	magkano ang tatlong labanos?
how much do three sesame cost?	magkano ang tatlong linga?
how much do three shark cost?	magkano ang tatlong pating?
how much do three shrimp cost?	magkano ang tatlong hipon?
how much do three squash cost?	magkano ang tatlong kalabasa?
how much do three squid cost?	magkano ang tatlong pusit?
how much do three strawberry cost?	magkano ang tatlong presa?
how much do three sugar apple cost?	magkano ang tatlong atis?
how much do three tomato cost?	magkano ang tatlong kamatis ?
how much do three turnip cost?	magkano ang tatlong singkamas?
how much do three wax gourd cost?	magkano ang tatlong kundol?
how much do three worm cost?	magkano ang tatlong bulate?
how much do twelve fish cost?	magkano ang labindalawang isda?
how much do twelve nuts cost?	magkano ang labindalawang mani?
how much do twenty fish cost?	magkano ang dalawampung isda?
how much do twenty ginger cost?	magkano ang dalawampung luya?
how much do twenty meat cost?	magkano ang dalawampung karne?
how much do twenty melon cost?	magkano ang dalawampung melon?
how much do twenty nuts cost?	magkano ang dalawampung mani?
how much do twenty pork cost?	magkano ang dalawampung baboy?
how much do twenty squid cost?	magkano ang dalawampung pusit?
how much do twenty worm cost?	magkano ang dalawampung bulate?
how much do two apple cost?	magkano ang dalawang mansanas?
how much do two banana cost?	magkano ang dalawang saging?
how much do two black plum cost?	magkano ang dalawang duhat?
how much do two bottle gourd cost?	magkano ang dalawang upo?
how much do two cabbage cost?	magkano ang dalawang repolyo?
how much do two crab cost?	magkano ang dalawang alimango?
how much do two durian cost?	magkano ang dalawang duryan?
how much do two eggplant cost?	magkano ang dalawang talong?
how much do two fish cost?	magkano ang dalawang isda?
how much do two garlic cost?	magkano ang dalawang bawang?
how much do two ginger cost?	magkano ang dalawang luya?
how much do two guava cost?	magkano ang dalawang bayabas?
how much do two jackfruit cost?	magkano ang dalawang langka?
how much do two lanzones cost?	magkano ang dalawang lanzones?
how much do two legumes cost?	magkano ang dalawang sitaw?
how much do two lima bean cost?	magkano ang dalawang bataw?
how much do two luffa cost?	magkano ang dalawang patola?
how much do two mango cost?	magkano ang dalawang mangga?
how much do two meat cost?	magkano ang dalawang karne?
how much do two melon cost?	magkano ang dalawang melon?
how much do two milkfish cost?	magkano ang dalawang bangus?
how much do two mustard cost?	magkano ang dalawang mustasa?
how much do two nuts cost?	magkano ang dalawang mani?
how much do two octopus cost?	magkano ang dalawang pugita?
how much do two onion cost?	magkano ang dalawang sibuyas?
how much do two orange cost?	magkano ang dalawang dalanghita?
how much do two papaya cost?	magkano ang dalawang papaya?
how much do two pineapple cost?	magkano ang dalawang pinya?
how much do two pork cost?	magkano ang dalawang baboy?
how much do two radish cost?	magkano ang dalawang labanos?
how much do two rambutan cost?	magkano ang dalawang rambutan?
how much do two sardines cost?	magkano ang dalawang sardinas?
how much do two sesame cost?	magkano ang dalawang linga?
how much do two shark cost?	magkano ang dalawang pating?
how much do two shrimp cost?	magkano ang dalawang hipon?
how much do two soursoup cost?	magkano ang dalawang guyabano?
how much do two squash cost?	magkano ang dalawang kalabasa?
how much do two squid cost?	magkano ang dalawang pusit?
how much do two strawberry cost?	magkano ang dalawang presa?
how much do two sugar apple cost?	magkano ang dalawang atis?
how much do two tamarind cost?	magkano ang dalawang sampalok?
how much do two tomato cost?	magkano ang dalawang kamatis ?
how much do two turnip cost?	magkano ang dalawang singkamas?
how much do two wax gourd cost?	magkano ang dalawang kundol?
how much do two worm cost?	magkano ang dalawang bulate?
How much do you need?	Magkano ba ang kailangan mo?
How much do you want it for?	Magkano mo ito gusto bilihin?
how much does a apple cost?	magakano ang isang mansanas?
how much does a banana cost?	magakano ang isang saging?
how much does a black plum cost?	magakano ang isang duhat?
how much does a bottle gourd cost?	magakano ang isang upo?
how much does a cabbage cost?	magakano ang isang repolyo?
how much does a crab cost?	magakano ang isang alimango?
how much does a durian cost?	magakano ang isang duryan?
how much does a eggplant cost?	magakano ang isang talong?
how much does a fish cost?	magakano ang isang isda?
how much does a garlic cost?	magakano ang isang bawang?
how much does a ginger cost?	magakano ang isang luya?
how much does a guava cost?	magakano ang isang bayabas?
how much does a jackfruit cost?	magakano ang isang langka?
how much does a kidney bean cost?	magakano ang isang patani?
how much does a lanzones cost?	magakano ang isang lanzones?
how much does a legumes cost?	magakano ang isang sitaw?
how much does a lima bean cost?	magakano ang isang bataw?
how much does a luffa cost?	magakano ang isang patola?
how much does a malay apple cost?	magakano ang isang makopa?
how much does a mango cost?	magakano ang isang mangga?
how much does a meat cost?	magakano ang isang karne?
how much does a melon cost?	magakano ang isang melon?
how much does a milkfish cost?	magakano ang isang bangus?
how much does a mustard cost?	magakano ang isang mustasa?
how much does a nuts cost?	magakano ang isang mani?
how much does a octopus cost?	magakano ang isang pugita?
how much does a onion cost?	magakano ang isang sibuyas?
how much does a orange cost?	magakano ang isang dalanghita?
how much does a papaya cost?	magakano ang isang papaya?
how much does a pineapple cost?	magakano ang isang pinya?
how much does a pork cost?	magakano ang isang baboy?
how much does a radish cost?	magakano ang isang labanos?
how much does a rambutan cost?	magakano ang isang rambutan?
how much does a sardines cost?	magakano ang isang sardinas?
how much does a sesame cost?	magakano ang isang linga?
how much does a shark cost?	magakano ang isang pating?
how much does a shrimp cost?	magakano ang isang hipon?
how much does a soursoup cost?	magakano ang isang guyabano?
how much does a squash cost?	magakano ang isang kalabasa?
how much does a squid cost?	magakano ang isang pusit?
how much does a starfruit cost?	magakano ang isang balimbing?
how much does a strawberry cost?	magakano ang isang presa?
how much does a sugar apple cost?	magakano ang isang atis?
how much does a tamarind cost?	magakano ang isang sampalok?
how much does a tomato cost?	magakano ang isang kamatis ?
how much does a turnip cost?	magakano ang isang singkamas?
how much does a wax gourd cost?	magakano ang isang kundol?
how much does a worm cost?	magakano ang isang bulate?
how much does one apple cost?	magkano ang isang mansanas?
how much does one banana cost?	magkano ang isang saging?
how much does one black plum cost?	magkano ang isang duhat?
how much does one bottle gourd cost?	magkano ang isang upo?
how much does one cabbage cost?	magkano ang isang repolyo?
how much does one crab cost?	magkano ang isang alimango?
how much does one durian cost?	magkano ang isang duryan?
how much does one eggplant cost?	magkano ang isang talong?
how much does one fish cost?	magkano ang isang isda?
how much does one garlic cost?	magkano ang isang bawang?
how much does one ginger cost?	magkano ang isang luya?
how much does one guava cost?	magkano ang isang bayabas?
how much does one jackfruit cost?	magkano ang isang langka?
how much does one kidney bean cost?	magkano ang isang patani?
how much does one lanzones cost?	magkano ang isang lanzones?
how much does one legumes cost?	magkano ang isang sitaw?
how much does one lima bean cost?	magkano ang isang bataw?
how much does one luffa cost?	magkano ang isang patola?
how much does one malay apple cost?	magkano ang isang makopa?
how much does one mango cost?	magkano ang isang mangga?
how much does one meat cost?	magkano ang isang karne?
how much does one melon cost?	magkano ang isang melon?
how much does one milkfish cost?	magkano ang isang bangus?
how much does one mustard cost?	magkano ang isang mustasa?
how much does one nuts cost?	magkano ang isang mani?
how much does one octopus cost?	magkano ang isang pugita?
how much does one onion cost?	magkano ang isang sibuyas?
how much does one orange cost?	magkano ang isang dalanghita?
how much does one papaya cost?	magkano ang isang papaya?
how much does one pineapple cost?	magkano ang isang pinya?
how much does one pork cost?	magkano ang isang baboy?
how much does one radish cost?	magkano ang isang labanos?
how much does one rambutan cost?	magkano ang isang rambutan?
how much does one sardines cost?	magkano ang isang sardinas?
how much does one sesame cost?	magkano ang isang linga?
how much does one shark cost?	magkano ang isang pating?
how much does one shrimp cost?	magkano ang isang hipon?
how much does one soursoup cost?	magkano ang isang guyabano?
how much does one squash cost?	magkano ang isang kalabasa?
how much does one squid cost?	magkano ang isang pusit?
how much does one strawberry cost?	magkano ang isang presa?
how much does one sugar apple cost?	magkano ang isang atis?
how much does one tamarind cost?	magkano ang isang sampalok?
how much does one tomato cost?	magkano ang isang kamatis ?
how much does one turnip cost?	magkano ang isang singkamas?
how much does one wax gourd cost?	magkano ang isang kundol?
how much does one worm cost?	magkano ang isang bulate?
How much does the newspaper cost?	Magkano ang dyaryo?
How much does the toll cost?	Magkano ang bayad sa toll?
How much does this magazine cost?	Magkano ang magasin na ito?
How much for ball of cheese?	Magkano keso de bola?
How much for ball of cheese?	Magkano sa keso de bola?
How much for banana ketchup?	Magkano banana ketchup?
How much for banana ketchup?	Magkano sa banana ketchup?
How much for banana blossom?	Magkano bulaklak ng saging?
How much for banana blossom?	Magkano sa bulaklak ng saging?
How much for banana heart?	Magkano puso ng saging?
How much for banana heart?	Magkano sa puso ng saging?
How much for bell pepper?	Magkano sa siling pari?
How much for bigeye snapper?	Magkano sa burara?
How much for butterflyfish?	Magkano paru-parong dagat?
How much for butterflyfish?	Magkano sa paru-parong dagat?
How much for cassava?	Magkano sa kamoteng kahoy?
How much for cavendish bananas?	Magkano lakatan?
How much for cavendish bananas?	Magkano sa lakatan?
How much for chinese cabbage?	Magkano sa petsay?
How much for chinese cabbage?	Magkano sa petchay?
How much for chinese celery?	Magkano sa kinchay?
How much for chinese celery?	Magkano sa kintsay?
How much for chub mackerel?	Magkano alumahang bato?
How much for chub mackerel?	Magkano sa alumahang bato?
How much for cilantro leaves?	Magkano sa wansuy?
How much for climbing perch?	Magkano martiniko?
How much for climbing perch?	Magkano sa liwalo?
How much for climbing perch?	Magkano sa martiniko?
How much for cocoyam?	Magkano gabing san fernando?
How much for cocoyam?	Magkano sa gabing san fernando?
How much for commerson's anchovy?	Magkano twakang?
How much for commerson's anchovy?	Magkano sa twakang?
How much for crab fat?	Magkano taba ng talangka?
How much for crab fat?	Magkano sa taba ng talangka?
How much for crimson snapper?	Magkano sa lohoran?
How much for deepbody sardinella?	Magkano lawlaw?
How much for deepbody sardinella?	Magkano lao-lao?
How much for deepbody sardinella?	Magkano sa lawlaw?
How much for deepbody sardinella?	Magkano sa lao-lao?
How much for deepwater red snapper?	Magkano tikwi?
How much for deepwater red snapper?	Magkano sagisi?
How much for deepwater red snapper?	Magkano sa tikwi?
How much for deepwater red snapper?	Magkano sa sagisi?
How much for fermented anchovy paste?	Magkano bagoong dilis?
How much for fermented fish paste?	Magkano bagoong?
How much for fermented fish paste?	Magkano sa bagoong?
How much for fermented zigandis paste?	Magkano bagoong padas?
How much for fourfinger threadfin?	Magkano mamali?
How much for fourfinger threadfin?	Magkano sa mamali?
How much for freshwater sardinella?	Magkano tawilis?
How much for freshwater sardinella?	Magkano sa tawilis?
How much for fried meatloaf sandwich?	Magkano kikiam?
How much for fried meatloaf sandwich?	Magkano kikyam?
How much for fried meatloaf sandwich?	Magkano sa kikiam?
How much for fried meatloaf sandwich?	Magkano sa kikyam?
How much for fringescale sardinella?	Magkano tunsoy?
How much for fringescale sardinella?	Magkano silinyasi?
How much for fringescale sardinella?	Magkano sa tunsoy?
How much for fringescale sardinella?	Magkano sa silinyasi?
How much for fusilier?	Magkano sa dalagang bukid?
How much for giant freshwater prawn?	Magkano ulang?
How much for giant freshwater prawn?	Magkano sa ulang?
How much for goldlined spinefoot?	Magkano kitong?
How much for goldlined spinefoot?	Magkano samaral?
How much for goldlined spinefoot?	Magkano sa kitong?
How much for goldlined spinefoot?	Magkano sa samaral?
How much for green bean?	Magkano sa bitsuwelas?
How much for green bean?	Magkano sa abitsuwelas?
How much for green onions?	Magkano sibuyas na mura?
How much for green onions?	Magkano sa sibuyas na mura?
How much for ground beef?	Magkano giniling na baka?
How much for ground beef?	Magkano sa giniling na baka?
How much for ground pork?	Magkano giniling na baboy?
How much for ground pork?	Magkano sa giniling na baboy?
How much for hawaiian ladyfish?	Magkano bidbid?
How much for hawaiian ladyfish?	Magkano sa bidbid?
How much for herring scad?	Magkano salay-salay?
How much for herring scad?	Magkano sa salaysalay?
How much for herring scad?	Magkano sa salay-salay?
How much for indo-pacific tarpon?	Magkano buan-buan?
How much for indo-pacific tarpon?	Magkano sa buan-buan?
How much for indo-pacific tarpon?	Magkano sa buwan-buwan?
How much for jamaica cherry?	Magkano sa aratiles?
How much for jasmine rice?	Magkano sa milagrosa?
How much for lacustrine goby fish?	Magkano dulong?
How much for lacustrine goby fish?	Magkano sa dulong?
How much for larger dark-speckled squid?	Magkano pusit lumot?
How much for liver spread?	Magkano liber spred?
How much for liver spread?	Magkano sa liber spred?
How much for lobed river mullet?	Magkano ludong?
How much for lobed river mullet?	Magkano sa ludong?
How much for long-jawed mackerel?	Magkano alumahan?
How much for long-jawed mackerel?	Magkano sa alumahan?
How much for mackerel scad?	Magkano galunggong?
How much for mackerel scad?	Magkano sa galunggong?
How much for mackerel tuna?	Magkano sa tulingan?
How much for malabar spinach?	Magkano alugbati?
How much for malabar spinach?	Magkano sa alugbati?
How much for mandarin orange?	Magkano dalanghita?
How much for mandarin orange?	Magkano sa dalanghita?
How much for maned goby fish?	Magkano talimusak?
How much for maned goby fish?	Magkano sa talimusak?
How much for mangrove king crab?	Magkano bulik?
How much for mangrove king crab?	Magkano putian?
How much for mangrove king crab?	Magkano sa bulik?
How much for mangrove king crab?	Magkano sa putian?
How much for mangrove red snapper?	Magkano isu?
How much for mangrove red snapper?	Magkano sa isu?
How much for mantis shrimp?	Magkano alupihang-dagat?
