kidney bean is the cheapest.	pinakamura ang patani.
kidney bean is the most expensive.	pinakamahal ang patani.
Kidney bean is very cheap.	Napakamura ng patani.
kidney bean is very expensive.	napakamahal ng patani.
Kids should drink milk.	Dapat uminom ang mga bata ng gatas.
Kids will slip off here.	Madudulas ang mga bata rito.
Kim bought six apples.	Bumili ng anim na mansanas si Kim.
Kindly bring the chalk box.	Pakidala sa kahon ng tisa.
Kindly hand over the paper clip.	Pakiabot ang paper clip.
Kindly look for my paper.	Hanapin mo nga yung papel ko.
Kindly put that inside.	Ipasok mo nga iyan sa loob.
Kindly put these aside.	Itabi mo nga ang mga ito.
Kindly put these inside.	Ipasok mo nga ang mga ito sa loob.
Kindly put this inside.	Ipasok mo nga ito sa loob.
Kindly put those aside.	Itabi mo nga ang mga iyan.
Kindly put those inside.	Ipasok mo nga ang mga iyan sa loob.
Kindly reach for the paper clip.	Pakiabot ang paper clip.
Kingdoms have fallen.	Bumagsak na ang mga kaharian.
Know wrong from right.	Alamin ang mali sa tama.
knoweth the day or the hour.	ang may alam ng araw o ng oras.
knows where they are.	nakaka-alam kung nasaan sila.
Kuya Clark is obedient.	Masunurin si Kuya Clark.
Kuya Clark is obedient.	Si Kuya Clark ay masunurin.
Kuya's nape is swelling.	Namamaga ang batok ni kuya.
Kuya's nape is swollen.	Namamaga ang batok ni kuya.
lanzones is more expensive.	mas mahal ang lanzones.
lanzones is not that cheap.	hindi ganoon kamura ang lanzones.
lanzones is the cheapest.	pinakamura ang lanzones.
lanzones is the most expensive.	pinakamahal ang lanzones.
Lanzones is very cheap.	Napakamura ng lanzones.
lanzones is very expensive.	napakamahal ng lanzones.
Last Monday is on August 28.	Huling Lunes ay sa Agosto 28.
Last Monday is on May 29.	Huling Lunes ay sa Mayo 29.
Last Saturday is on June 24.	Huling Sabado ay Hunyo 24.
Last Sunday is on 30 July.	Huling Linggo ay sa Hulyo 30.
Last Sunday is on August 27.	Huling Linggo ay sa Agosto 27.
Last Sunday is on June 30.	Huling Linggo ay Hunyo 30.
Last Sunday is on May 28.	Huling Linggo ay sa Mayo 28.
Last Thursday is on June 29.	Huling Huwebes ay Hunyo 29.
Last Thursday is on May 25.	Huling Huwebes ay sa Mayo 25.
Late for a few minutes.	Nahuli ng ilang minuto.
Learn from your mistakes.	Matuto ka sa iyong mga kamalian.
Learn Spanish in Your Car.	Matuto ng Espanyol sa Iyong Kotse.
Legends don't retire.	Ang mga alamat ay hindi nagreretiro.
legumes is getting more expensive.	mas nagmumura ang sitaw.
Legumes is more expensive.	Mas mahal ang sitaw.
legumes is not that cheap.	hindi ganoon kamura ang sitaw.
legumes is the most expensive.	pinakamahal ang sitaw.
Legumes is very expensive.	Napakamahal ng sitaw.
Lend me 200 pesos.	Pautang ng dalawang daang piso.
Lend me two hundred pesos.	Pautang ng dalawang daang piso.
Lend me your ballpen.	Pahiram ako ng bolpen mo.
Lend me your ballpen.	Pahiramin mo ako ng bolpen mo.
Lend me your calculator.	Pahiram ako ng calculator mo.
Lend me your calculator.	Pahiramin mo ako ng calculator mo.
Lend me your cellphone.	Pahiram ng cellphone mo.
Lend me your eraser.	Pahiram ako ng pambura mo.
Lend me your eraser.	Pahiramin mo ako ng pambura mo.
Lend me your notebook.	Pahiram ako ng kwaderno mo.
Lend me your notebook.	Pahiramin mo ako ng kwaderno mo.
Lend me your pencil.	Pahiramin mo ako ng lapis mo.
Let me borrow your ballpen.	Pahiram ako ng bolpen mo.
Let me borrow your ballpen.	Pahiramin mo ako ng bolpen mo.
Let me borrow your calculator.	Pahiram ako ng calculator mo.
Let me borrow your eraser.	Pahiram ako ng pambura mo.
Let me borrow your eraser.	Pahiramin mo ako ng pambura mo.
Let me borrow your notebook.	Pahiram ako ng kwaderno mo.
Let me borrow your notebook.	Pahiramin mo ako ng kwaderno mo.
Let me borrow your pencil.	Pahiram ako ng lapis mo.
Let me borrow your pencil.	Pahiramin mo ako ng lapis mo.
Let me borrow your umbrella.	Pahiram ng payong mo.
Let me bring your bag.	Hayaan mong dalhin ko ang iyong bag.
Let me catch my breath.	Pahabulin mo ako ng hininga.
Let me do it for you.	Hayaan mo akong gawin iyan para sayo.
Let me help you.	Hayaan ninyong tulungan ko kayo.
Let me know if this is yours.	Ipaalam mo kung sa iyo ito.
Let me pay tonight.	Hayaan mo akong magbayad ngayong gabi.
Let me pay tonight.	Hayaan mo akong magbayad mamayang gabi.
Let me see what we have.	Tingan namin kung anong mayroon kami.
Let me take care of this.	Ako na ang bahala rito.
Let me take care of you.	Ako na ang bahala sa iyo.
Let me tell you why.	Hayaan mong sabihin ko sayo.
Let our guest in.	Papasukin mo ang ating bisita.
Let us be alone together.	Maging mag isa tayong magkasama.
Let us change the subject.	Baguhin natin ang paksa.
Let us clean your hands.	Linisin natin ang iyong mga kamay.
let us do better next time.	Bawi na lang tayo sa susunod.
Let us face the challenges.	Harapin natin ang mga pagsubok.
Let us find a better place.	Hahanap tayo ng mabuting lugar.
Let us find your cat.	Hanapin natin ang pusa mo.
Let us follow the music.	Sabayan natin ang musika.
Let us go back to the start.	Bumalik tayo sa umpisa.
Let us go on a trip to Baguio.	Bumiyahe tayo papuntang Baguio.
Let us go there early.	Punta tayo doon ng maaga.
Let us go to school.	Pumunta na tayo sa paaralan.
Let us go to Tagaytay.	Pumunta tayo sa Tagaytay.
Let us go to that island.	Puntahan natin ang islang iyon.
Let us go to the market.	Punta tayo sa tindahan.
Let us go to the mountain.	Punta tayo sa bundok.
Let us go to your house.	Punta tayo sa inyong bahay.
Let us have faith in God.	Manalig tayo sa Diyos.
Let us heal the world.	Gamutin natin ang mundo.
Let us jump over the tables.	Talunan natin ang mga mesa.
Let us jump over your table.	Talunan natin ang mesa mo.
Let us lie down on the bed.	Humiga tayo sa higaan.
Let us light up the dark.	Magliwanag tayo sa dilim.
Let us love our parents.	Mahalin natin ang ating magulang.
Let us not talk too much.	Huwag tayong masyadong magsalita.
Let us play hide and seek.	Maglalaro tayo ng taguan.
Let us play in the forest.	Tayo nang maglaro sa gubat.
Let us see each other again.	Magkita mula tayo.
Let us share our food.	Pagsaluhan natin ang ating pagkain.
Let us start on Monday.	Magsimula tayo sa lunes.
Let us stop this already.	Itigil na natin into.
Let us talk tomorrow.	Bukas na lang tayo mag usap.
Let us trust God Almighty.	Magtiwala tayo sa Poong Maykapal.
Let us walk around first.	Mag-lakad-lakad muna tayo.
Let's all think about it.	Pag-isipan nating lahat.
Let's buy food outside.	Bumili tayo ng pagkain sa labas.
Let's discuss this later.	pag-usapan natin mamaya.
Let's do dinner tomorrow.	Maghapunan tayo bukas.
Let's do it tonight.	Gawin natin iyon ngayong gabi.
Let's do it tonight.	Gawin natin ito mamayang gabi.
Let's do it tonight.	Gawin natin iyon ngayong gabi.
Let's do it tonight.	Gawin natin ito mamayang gabi.
Let's do this later.	Gawin na lang natin mamaya.
Let's drive to the bay.	Magmaneho tayo papunta sa bapor.
Let's drive to the hill.	Magmaneho tayo papunta sa burol.
Let's drive to the island.	Magmaneho tayo papunta sa isla.
Let's drive to the lake.	Magmaneho tayo papunta sa lawa.
Let's drive to the mountain.	Magmaneho tayo papunta sa bundok.
Let's drive to the ocean.	Magmaneho tayo papunta sa karagatan.
Let's drive to the plain.	Magmaneho tayo papunta sa kapatagan.
Let's drive to the river.	Magmaneho tayo papunta sa ilog.
Let's drive to the sea.	Magmaneho tayo papunta sa dagat.
Let's drive to the valley.	Magmaneho tayo papunta sa lambak.
Let's drive to the volcano.	Magmaneho tayo papunta sa bulkan.
Let's eat before we go.	Kain muna tayo bago umalis.
Let's eat out next Sunday.	Kumain tayo sa susunod na Linggo.
Let's eat out tonight.	Kain tayo sa labas mamayang gabi.
Let's eat pansit palabok!	Kain naman tayo ng pansit palabok!
Let's fly a kite.	Magpalipad tayo ng saranggola.
Let's focus on the cheese.	Tutukan na lang natin ang keso.
Let's get our photograph taken.	Magpakuha tayo ng litrato.
Let's get together tomorrow.	tayo'y magkita-kita bukas.
Let's get two more eggs.	Kumuha pa tayo ng dalawang itlog.
Let's go by taxi, shall we?	Magtaksi tayo, ano?
Let's go early, shall we?	pumunta tayo nang maaga no?
Let's go grab a burger or something.	Tara, mag-burger tayo.
Let's go to the canteen.	Punta tayo sa kantina.
Let's go to the canteen.	Pumunta na tayo sa kantina.
Let's go to the dining table.	Pumunta tayo sa hapag-kainan.
Let's go to the hospital.	Pumunta tayo sa ospital.
Let's go to the seashore.	Magtungo tayo sa dalampasigan.
Let's go tomorrow afternoon.	tayo'y pumunta bukas ng hapon.
Let's have a drink or something.	Inom tayo o kung ano man.
Let's have a picture taken.	Magpakuha tayo ng litrato.
Let's hold our hands together.	Maghawak-hawak tayo ng kamay.
Let's just hope it works.	Umasa tayong gagana siya.
Let's leave it till tomorrow.	pabayaan natin hanggang bukas.
Let's leave tomorrow morning.	tayo'y umalis bukas nang umaga.
Let's meet at eight o'clock.	Magkita tayo ng alas-otso.
Let's meet halfway at 6.	Magsalubong na lang po tayo sa 6.
Let's not talk about that.	Huwag natin iyang pag-usapan.
Let's play in the forest.	Tayo nang maglaro sa gubat.
Let's postpone dinner.	Ipagpaliban natin ang hapunan.
Let's start to use this.	SImulan natin itong gamitin.
Let's start tonight.	Magsimula tayo mamayang gabi.
Let's start tonight.	Sinmulan natin iyon ngayong gabi.
Let's stay awhile over there.	Tambay tayo doon.
Let's stay in tonight.	Manatili tayo ngayong gabi.
Let's stay until the end of the game.	Tapusin natin ang laro.
Let's talk about this later.	pag-usapan na lang natin mamaya.
Let's talk about this tomorrow.	pag-usapan natin ito bukas.
Let's travel together.	Maglakbay tayo ng magkasama.
Let's wait until Monday.	Maghintay tayo hanggang Lunes.
Let's walk around first.	Lakad-lakad muna tayo.
Let's walk to class.	Lakad tayo papuntang klase.
Let's reach the stars.	Abutin natin ang mga bituin.
Let's meet on October 1.	Magkita tayo sa ika-isa ng Oktubre.
Let's meet on October 3.	Magkita tayo sa ika-tatlo ng Oktubre.
Let's meet on October 4.	Magkita tayo sa ika-apat ng Oktubre.
Let's meet on October 5.	Magkita tayo sa ika-lima ng Oktubre.
Let's meet on October 6.	Magkita tayo sa ika-anim ng Oktubre.
Let's meet on October 7.	Magkita tayo sa ika-pito ng Oktubre.
Let's meet on October 8.	Magkita tayo sa ika-siyam ng Oktubre.
Levi wants to be happy.	Gustong sumaya ni Levi.
Life can get you down.	Kaya kang ibaba ng buhay.
Life is full of mysteries.	Ang buhay ay puno ng misteryo.
Life is full of surprises.	Ang buhay ay puno ng surpresa.
Like an escaped convict.	Parang nakatakas na preso.
Like yesterday, I guess.	Kagaya kahapon, sa tingin ko.
lima bean is getting more expensive.	mas nagmumura ang bataw.
Lima bean is more expensive.	Mas mahal ang bataw.
lima bean is not that cheap.	hindi ganoon kamura ang bataw.
Lima bean is the cheapest.	Pinakamura ang bataw.
lima bean is the most expensive.	pinakamahal ang bataw.
lima bean is very expensive.	napakamahal ng bataw.
Limes are cheap in the market.	Mura sa palengke ang mga dayap.
Lions can handle ice.	Kaya ng mga leon ang nyebe.
Lions can handle the cold.	Kaya ng mga leon ang lamig.
Listen first before you act.	Makinig muna bago ka kumilos.
Listen to the recording.	Pakinggan mo ang pagtatala.
Listen to your teacher.	Makinig ka sa iyong guro.
Literally, it's picturesque.	Literal na parang larawan ito.
Litter around the area increased.	Dumami ang kalat sa lugar.
living the good life.	nabubuhay sa magandang buhay.
Lobbing hurts others.	Ang pang-iitsa ay nakakasakit ng iba.
London is in England.	Ang London ay nasa Inglatera.
London is not in France.	Ang London ay wala sa Pransya.
Look at this page.	Tingnan moa ng pahinang ito.
Look before you leap.	tumingin muna bago ka tumalon.
look for his appearing.	naghinhintay na makita siya.
Look it up in your dictionary.	Hanapin mo sa diksiyunaryo.
Look to your left.	Tumingin ka sa iyong kaliwa.
Look to your right.	Tumingin ka sa iyong kanan.
Looks like you hit the big time.	Mukhang asensado ka na.
Loricifera Ten types.	Loricifera Sampung mga uri.
Love conquers all.	Malalagpasan lahat ng pag-ibig.
Love God above all.	Mahalin mo ang Diyos higit sa lahat.
Love is incomparable.	Ang pagmamahal ay walang katumbas.
Love is like a rosary.	Ang pag ibig ay parang rosaryo.
Love is powerful.	Makapangyarihan ang pag-ibig.
Love triumphs evil.	Nananaig ang pagmamahal sa kasamaan.
Loving can hurt.	Puwedeng magdulot ng pasakit ang pagmamahal.
Loving isn't tiring.	Hindi nakakapagod magmahal.
Lucia is selling milk.	Nagbebenta si Lucia ng gatas.
luffa is getting more expensive.	mas nagmumura ang patola.
luffa is not that cheap.	hindi ganoon kamura ang patola.
luffa is the most expensive.	pinakamahal ang patola.
Luffa is very expensive.	Napakamahal ng patola.
Luke covers it in chapter 17 and chapter 21.	Tinatalakay iyan ni Lukas sa kabanata 17 at kabanata 21.
Lunch is at noon.	Ang tanghalian ay tuwing tanghali.
Lunch is not yet ready.	Hindi pa handa ang tanghalian.
Lunch is still not ready.	Hindi pa handa ang tanghalian.
Luncy is not ready.	Hindi handa ang tanghalian.
Ma'am, one photo please.	Ma'am, isang larawan lang po.
The train station is nearby.	Malapit ang estasyon ng tren.
The ship left early.	Maagang umalis ang barko.
Machines were his passion.	Hilig nya ang makina.
Mahmoud Ahmadinejad: Oh God.	Mahmoud Ahmadinejad: O Diyos.
Make me laugh hard.	Patawahin mo ako ng malakas.
Make your decision now.	Gumawa ka na ng desisyon.
Make your life worthwhile.	Bigyan ng halaga ang iyong buhay.
The trip was very expensive.	Ang byahe ay sobrang magastos.
malay apple is more expensive.	mas mahal ang makopa.
malay apple is the cheapest.	pinakamura ang makopa.
malay apple is the most expensive.	pinakamahal ang makopa.
Malay apple is very cheap.	Napakamura ng makopa.
malay apple is very expensive.	napakamahal ng makopa.
Mandarin oranges are delicious.	Masarap ang mga dalanghita.
mango is getting more expensive.	mas nagmumura ang mangga.
Mango is good for the body.	Maganda sa katawan ang mangga.
mango is not that cheap.	hindi ganoon kamura ang mangga.
mango is the most expensive.	pinakamahal ang mangga.
Mango is very expensive.	Napakamahal ng mangga.
Mango makes you smarter.	Pampatalino ang mangga.
Mangoes are sour when green.	Maasim ang mga mangga kung berde.
Mangoes are yellow when ripe.	Dilaw ang mga mangga kung hinog.
Manila bean is cheaper.	Mas mura ang sigarilyas.
Manila bean is expensive.	Mahal ang sigarilyas.
manila bean is more expensive.	mas mahal ang sigarilyas.
manila bean is the cheapest.	pinakamura ang sigarilyas.
manila bean is very cheap.	napakamura ng sigarilyas.
manila bean is very expensive.	napakamahal ng sigarilyas.
Many ants are angry.	Maraming langgam ang nagalit.
Many are also asking.	Marami ay nagtatanong din.
Many are asking too.	Marami ay nagtatanong din.
Many bears eat fish.	Maraming oso ang hkumakain ng isda.
Many bears eat meat.	Maraming oso ang kumakain ng karne.
Many bears got scared.	Maraming oso ang natatakot.
Many birds are scared.	Maraming ibon ang takot.
Many cats auditioned.	Maraming pusa ang sumali.
Many cats held back.	Maraming pusa ang nagtimpi.
Many chickens are sleepy.	Maraming manok ang inaantok.
many different governments.	maraming ibat-ibang mga gobyerno.
Many ducks are jealous.	Maraming bibe ang nagselos.
Many ducks have legs.	Maraming bibe ang may paa.
Many elephants auditioned.	Maraming elepante ang sumali.
Many elephants held back.	Maraming elepante ang nagtimpi.
Many fireflies are scared.	Maraming alitaptap ang takot.
Many goats eat fish.	Maraming kambing ang hkumakain ng isda.
Many goats eat meat.	Maraming kambing ang kumakain ng karne.
Many goats got scared.	Maraming kambing ang natatakot.
Many jellyfishes are sleepy.	Maraming dikya ang inaantok.
Many lions are jealous.	Maraming leon ang nagselos.
Many lions have legs.	Maraming leon ang may paa.
Many of the bulls are lost.	Marami sa mga toro ang naliligaw.
Many of the cats watched.	Marami sa mga pusa ang nanood.
Many of the pigs are lost.	Marami sa mga baboy ang naliligaw.
Many of us will graduate.	Marami kaming magsisipagtapos.
Many people are scared of this.	Maraming tao ang takot dito.
Many rooted for evil.	Marami ang sumoporta sa kasamaan.
Many rooted for good.	Marami ang sumoporta sa kabutihan.
Many sharks are hungry.	Maraming pating ang nagugutom.
Many sheep are scared.	Maraming tupa ang takot.
Many snakes are jealous.	Maraming ahas ang nagselos.
Many snakes have legs.	Maraming ahas ang may paa.
Many spiders are angry.	Maraming gagamba ang nagalit.
Many swans are angry.	Maraming gansa ang nagalit.
Many things needed to do.	Maraming kailangang gawin.
Many will come in later.	Maraming papasok mamaya.
Many will come in tomorrow.	Maraming papasok bukas.
March one is the date today.	Ikauna ng Marso ang petsa ngayon.
Marie loves the beach.	Mahal ni Marie ang dagat.
Mary is a very pretty girl.	Si Mary ay isang magandang babae.
It's more fun in the Philippines.	Mas masaya sa Pilipinas.
Masa is a nice cat.	Si Masa ay isang mabait na pusa.
Massive, Elena says.	Napakalaki, sabi ni Elena.
Math is a hard subject.	Mahirap na asignatura ang matematika.
Mathematics is hard.	Ang matematika ay mahirap.
Mathematics is her weak point.	Mahina siya sa sipnayan.
Mathematics is tiring.	Nakakapagod ang matematika.
Matriculation is expensive.	Mahal ang pangmatrikula.
May eight is the date today.	Ikawalo ng Mayo ang petsa ngayon.
May five is the date today.	Ikalima ng Mayo ang petsa ngayon.
May four is the date today.	Ikaapat ng Mayo ang petsa ngayon.
I was busy with school.	May ginagawa ako sa eskwelahan.
May I ask a question?	Maaari ba akong magtanong?
May I ask for a bargain?	Maaari bang makahingi naman po ng tawad?
May I ask you a question?	Pwede ba kitang tanungin?
May I ask you a question?	Maaari ba akong magtanong sa iyo?
May I begin to eat?	Puwede na bang magsimulang kumain ako?
May I borrow an umbrella?	Pwede bang pahiram ng payong?
May I borrow an umbrella?	Pwede bang maki-hiram ng payong?
May I borrow your umbrella?	Pwede bang pahiram ng payong mo?
May I call later?	Pwede ba akong tumawag mamaya?
May I call you tomorrow?	pwede ba kitang tawagan bukas?
May I come tomorrow, too?	pwede rin bang pumunta ako bukas?
May I go to the CR?	Maari ba akong pumunta sa palikuran?
May I have a napkin, please?	Isang napkin, nga?
May I have this magazine?	Puwede bang akin na itong magasin?
May I see you tomorrow?	pwede ba kitang makita bukas?
May I take the glass?	Pwedeng kunin ko muna ang baso?
May I try some of them on?	Pwede ko ba subukan ang ilan dito?
May I use the telephone?	Maari ko bang gamitin ang telepono?
May I visit you tomorrow?	pwede ba kitang puntuhan bukas?
There are five pencils here.	May limang lapis dito.
There are five pencils here.	Mayroong limang lapis dito.
May nine is the date today.	Ikasiyam ng Mayo ang petsa ngayon.
May one is the date today.	Ikauna ng Mayo ang petsa ngayon.
May seven is the date today.	Ikapito ng Mayo ang petsa ngayon.
May six is the date today.	Ikaanim ng Mayo ang petsa ngayon.
May ten is the date today.	Ikasampu ng Mayo ang petsa ngayon.
May three is the date today.	Ikatlo ng Mayo ang petsa ngayon.
Somone is asking for help.	May tumatawag ng tulong.
Thanks for your explanation.	Salamat sa iyong paliwanag.
May two is the date today.	Ikalawa ng Mayo ang petsa ngayon.
May visited her friend.	Binisita ni May ang kanyang kaibigan.
May we go later?	Pwede ba tayong pumunta mamaya?
May we go tomorrow?	Pwede ba tayong pumunta bukas?
Maybe 800 centimeters wide.	Siguro 800 sentimetro ang lapad.
Maybe I can die tomorrow.	Baka pwede na ako mamatay bukas.
Maybe I'll see you later.	baka magkita tayo mamaya.
Maybe if you have a lot money.	Pwede siguro kung makwarta ka.
Maybe it won't rain tomorrow.	baka naman hindi uulan bukas.
Maybe the kid is hungry.	Baka gutom na ang bata.
Maybe the teacher favors you.	Pinapaboran ka siguro ng guro.
Maybe tomorrow you would know.	Marahil bukas ay malalaman mo.
Maybe we are destined.	Baka tayo ay itinadhana.
Maybe we should play it safe.	Siguro dapat tayong mag-ingat.
Meanwhile, I'll make corrections.	Aayusin ko muna ang mali.
meat is getting more expensive.	mas nagmumura ang karne.
meat is not that cheap.	hindi ganoon kamura ang karne.
meat is not that expensive.	hindi ganoong kamahal ang karne.
meat is the most expensive.	pinakamahal ang karne.
Medicine is what he is studying.	Medisina ang inaaral niya.
Medicine is what I am studying.	Medisina ang inaaral ko.
Medicine is what she is studying.	Medisina ang inaaral niya.
melon is getting more expensive.	mas nagmumura ang melon.
melon is not that cheap.	hindi ganoon kamura ang melon.
melon is not that expensive.	hindi ganoong kamahal ang melon.
melon is the most expensive.	pinakamahal ang melon.
Mental health is important.	Ang kalusugan ng isip ay mahalaga.
Michael Jackson fifty-seven.	Michael Jackson limampu't pitong.
might buy or sell.	ang makakabili o makakapagbenta.
Milk is good for the body.	Maganda sa katawan ang gatas.
Milk is now expensive.	Ang mahal na ng gatas ngayon.
milkfish is getting more expensive.	mas nagmumura ang bangus.
Milkfish is more expensive.	Mas mahal ang bangus.
milkfish is not that cheap.	hindi ganoon kamura ang bangus.
Milkfish is the cheapest.	Pinakamura ang bangus.
milkfish is the most expensive.	pinakamahal ang bangus.
milkfish is very expensive.	napakamahal ng bangus.
Mine is too long.	Ang akin ay masyadong mahaba.
Sometimes it's hard to love.	Minsan mahirap magmahal.
Mollusca 93,000 types.	Mollusca 93,000 mga uri.
Mom, when's supper?	Inay, kailan ang gabihan?
Monday is my favorite day.	Ang paborito kong araw ay lunes.
Money can't buy love.	Hindi nabibili ng pera ang pagmamahal.
Monkeys are nice to humans.	Mababit ang mga unggoy sa mga tao.
Monkeys climb trees.	Umaakyat ng mga puno ang mga unggoy.
Monkeys do not have thumbs.	Walang hinlalaki ang mga unggoy.
More than just your socks.	Meron pa, maliban sa medyas mo.
Morning of December 1.	Umaga ng ika-isa ng Disyembre.
Morning of December 10.	Umaga ng ika-sampu ng Disyembre.
Morning of December 11.	Umaga ng ika-labing-isa ng Disyembre.
Morning of December 12.	Umaga ng ika-labindalawa ng Disyembre.
Morning of December 13.	Umaga ng ika-labintatlo ng Disyembre.
Morning of December 14.	Umaga ng ika-labing-apat ng Disyembre.
Morning of December 15.	Umaga ng ika-labinlima ng Disyembre.
Morning of December 16.	Umaga ng ika-labing-anim ng Disyembre.
Morning of December 17.	Umaga ng ika-labinpito ng Disyembre.
Morning of December 18.	Umaga ng ika-labinwalo ng Disyembre.
Morning of December 19.	Umaga ng ika-labingsiyam ng Disyembre.
Morning of December 2.	Umaga ng ika-dalawa ng Disyembre.
Morning of December 20.	Umaga ng ika-dalawampu ng Disyembre.
Morning of December 3.	Umaga ng ika-tatlo ng Disyembre.
Morning of December 30.	Umaga ng ika-tatlumpu ng Disyembre.
Morning of December 4.	Umaga ng ika-apat ng Disyembre.
Morning of December 5.	Umaga ng ika-lima ng Disyembre.
Morning of December 6.	Umaga ng ika-anim ng Disyembre.
Morning of December 7.	Umaga ng ika-pito ng Disyembre.
Morning of December 8.	Umaga ng ika-siyam ng Disyembre.
Morning of November 1.	Umaga ng ika-isa ng Nobyembre.
Morning of November 10.	Umaga ng ika-sampu ng Nobyembre.
Morning of November 11.	Umaga ng ika-labing-isa ng Nobyembre.
Morning of November 12.	Umaga ng ika-labindalawa ng Nobyembre.
Morning of November 13.	Umaga ng ika-labintatlo ng Nobyembre.
Morning of November 14.	Umaga ng ika-labing-apat ng Nobyembre.
Morning of November 15.	Umaga ng ika-labinlima ng Nobyembre.
Morning of November 16.	Umaga ng ika-labing-anim ng Nobyembre.
Morning of November 17.	Umaga ng ika-labinpito ng Nobyembre.
Morning of November 18.	Umaga ng ika-labinwalo ng Nobyembre.
Morning of November 19.	Umaga ng ika-labingsiyam ng Nobyembre.
Morning of November 2.	Umaga ng ika-dalawa ng Nobyembre.
Morning of November 20.	Umaga ng ika-dalawampu ng Nobyembre.
Morning of November 3.	Umaga ng ika-tatlo ng Nobyembre.
Morning of November 30.	Umaga ng ika-tatlumpu ng Nobyembre.
Morning of November 4.	Umaga ng ika-apat ng Nobyembre.
Morning of November 5.	Umaga ng ika-lima ng Nobyembre.
Morning of November 6.	Umaga ng ika-anim ng Nobyembre.
Morning of November 7.	Umaga ng ika-pito ng Nobyembre.
Morning of November 8.	Umaga ng ika-siyam ng Nobyembre.
Morning of October 1.	Umaga ng ika-isa ng Oktubre.
Morning of October 10.	Umaga ng ika-sampu ng Oktubre.
Morning of October 11.	Umaga ng ika-labing-isa ng Oktubre.
Morning of October 12.	Umaga ng ika-labindalawa ng Oktubre.
Morning of October 13.	Umaga ng ika-labintatlo ng Oktubre.
Morning of October 14.	Umaga ng ika-labing-apat ng Oktubre.
Morning of October 15.	Umaga ng ika-labinlima ng Oktubre.
Morning of October 16.	Umaga ng ika-labing-anim ng Oktubre.
Morning of October 17.	Umaga ng ika-labinpito ng Oktubre.
Morning of October 18.	Umaga ng ika-labinwalo ng Oktubre.
Morning of October 19.	Umaga ng ika-labingsiyam ng Oktubre.
Morning of October 2.	Umaga ng ika-dalawa ng Oktubre.
Morning of October 20.	Umaga ng ika-dalawampu ng Oktubre.
Morning of October 3.	Umaga ng ika-tatlo ng Oktubre.
Morning of October 30.	Umaga ng ika-tatlumpu ng Oktubre.
Morning of October 4.	Umaga ng ika-apat ng Oktubre.
Morning of October 5.	Umaga ng ika-lima ng Oktubre.
Morning of October 6.	Umaga ng ika-anim ng Oktubre.
Morning of October 7.	Umaga ng ika-pito ng Oktubre.
Morning of October 8.	Umaga ng ika-siyam ng Oktubre.
Morning of September 1.	Umaga ng ika-isa ng Septyembre.
Morning of September 10.	Umaga ng ika-sampu ng Septyembre.
Morning of September 15.	Umaga ng ika-labinlima ng Septyembre.
Morning of September 17.	Umaga ng ika-labinpito ng Septyembre.
Morning of September 18.	Umaga ng ika-labinwalo ng Septyembre.
Morning of September 2.	Umaga ng ika-dalawa ng Septyembre.
Morning of September 20.	Umaga ng ika-dalawampu ng Septyembre.
Morning of September 3.	Umaga ng ika-tatlo ng Septyembre.
Morning of September 30.	Umaga ng ika-tatlumpu ng Septyembre.
Morning of September 4.	Umaga ng ika-apat ng Septyembre.
Morning of September 5.	Umaga ng ika-lima ng Septyembre.
